filename,caption,truncated_caption,source,source_type,disease_label,hierarchical_disease_label,skin_concept,body_location,symptoms,age,gender
IIYI/19461_4.png,"An 8-year-old male patient is experiencing nail malnutrition (甲营养不良). Routine blood tests, trace elements, and fungal tests on nails have all returned normal results. There was a discussion among forum users about the diagnosis and treatment of the patient's condition. It was mentioned that nail malnutrition can be difficult to diagnose and treat, and suggested treatments were largely limited to supplementing trace elements. Different diagnoses such as nail eczema or lichen planus were considered, though the exact diagnosis remained unclear. There were mentions of conditions including nail thickening and irregularities accompanied by redness around the nails. A suggestion was made to conduct a pathological examination to better identify the condition, possibly leaning towards the diagnosis of nail lichen planus.","An 8-year-old male patient is experiencing nail malnutrition . Routine blood tests, trace elements, and fungal tests on nails have all returned normal results. There was a discussion among forum users about the diagnosis and treatment of the patient's condition. It was mentioned that nail malnutrition can be difficult to diagnose and treat, and suggested treatments were largely limited to supplementing trace elements. Different diagnoses such as nail eczema or lichen planus were considered, though the exact diagnosis remained unclear. There were mentions of conditions including nail thickening and irregularities accompanied by redness around the nails. A suggestion was made to conduct a pathological examination to better identify the condition, possibly leaning towards the diagnosis of nail lichen planus.",IIYI_chinese,forum,"eczema, lichen planus, nail disease","inflammatory, non-infectious, eczema, lichen planus, nail disease",No visual concepts,nails,No symptom information,8,male
note/Sewon-Kang-Fitzpatrick’s-Dermatology[2-Volume Set]-McGraw-Hil-Education(2019)-part6_00276_01143_0.png,Erythrasma Welldemarcated reddishbrown patches in the axilla and groin The potassium hydroxide preparations were negative  Woods lamp examination showed a bright coral red fluorescence,Erythrasma Welldemarcated reddishbrown patches in the axilla and groin The potassium hydroxide preparations were negative  Woods lamp examination showed a bright coral red fluorescence,textbook_fail,knowledge,erythrasma,erythrasma,"red, patch",groin,No symptom information,No age information,No gender information
youtube/p5-sNkNQHUY_frame_29037_0.jpg,"This image depicts a person with a skin disease characterized by a red, itchy rash on their arm. The cause of the rash is an allergic reaction to a particular substance, and the treatment involves avoiding the allergen and using over-the-counter creams to relieve the symptoms.","This image depicts a person with a skin disease characterized by a red, itchy rash on their arm. The cause of the rash is an allergic reaction to a particular substance, and the treatment involves avoiding the allergen and using over-the-counter creams to relieve the symptoms.",youtube,edu,allergic contact dermatitis,"inflammatory, non-infectious, eczema, contact dermatitis, allergic contact dermatitis",red,arm,No symptom information,No age information,No gender information
pubmed/71_7f_PMC4149335_cia_9_1409Fig1_1.png,Abscess of the mandible affecting the extraction area. The pus is leaking from the empty alveolus. The infection and swelling extend to the second molar.,Abscess of the mandible affecting the extraction area. The pus is leaking from the empty alveolus. The infection and swelling extend to the second molar.,pubmed_english,knowledge,cellulitis,"inflammatory, infectious, bacterial, cellulitis",No visual concepts,No body location information,No symptom information,No age information,No gender information
youtube/jdaN189qAVU_frame_1394_0_0.jpg,"This image shows a close-up view of a skin disease characterized by red, inflamed patches on the skin. The cause of this condition is an overactive immune response, and treatment options include topical steroids and immunosuppressive medications.","This image shows a close-up view of a skin disease characterized by red, inflamed patches on the skin. The cause of this condition is an overactive immune response, and treatment options include topical steroids and immunosuppressive medications.",youtube,edu,"irritated seborrheic keratosis (from ""sk/isk"")","proliferations, benign, non-melanocytic, seborrheic keratosis, irritated seborrheic keratosis (from ""sk/isk"")","red, patch",No body location information,No symptom information,No age information,No gender information
pubmed/bd_c1_PMC8884525_gox-10-e4001-g004_0.jpg,Nonhealing wound on posterolateral heel with exposed Achilles tendon and calcaneum wound after debridement.,Nonhealing wound on posterolateral heel with exposed Achilles tendon and calcaneum wound after debridement.,pubmed_fail,knowledge,local infection of wound,"reaction patterns and descriptive terms, wound/abrasion, local infection of wound",No visual concepts,No body location information,No symptom information,No age information,No gender information
youtube/283tIZpT1nA_frame_4307_0.jpg,"This image shows a black structureless skin lesion, which could be a sign of a skin disease such as melanoma. The exact cause and treatment options depend on the specific type of skin disease.","This image shows a black structureless skin lesion, which could be a sign of a skin disease such as melanoma. The exact cause and treatment options depend on the specific type of skin disease.",youtube,edu,melanoma,"proliferations, malignant, melanocytic, malignant melanoma, melanoma",black,No body location information,No symptom information,No age information,No gender information
youtube/1OuTdRRFqd0_frame_12623_0_0.jpg,"This image depicts a skin disease characterized by extreme discomfort, with a red and inflamed appearance. The cause of the disease is not clear, but it may be related to an allergic reaction or an infection. Treatment options include topical creams or ointments, oral medications, and in some cases, corticosteroids or immunosuppressants.","This image depicts a skin disease characterized by extreme discomfort, with a red and inflamed appearance. The cause of the disease is not clear, but it may be related to an allergic reaction or an infection. Treatment options include topical creams or ointments, oral medications, and in some cases, corticosteroids or immunosuppressants.",youtube,edu,no definitive diagnosis,no definitive diagnosis,red,oral,No symptom information,No age information,No gender information
youtube/7RWVilxv6r8_frame_14966_0_0.jpg,"This image depicts lymphoma, a type of cancer that affects the lymphatic system, characterized by the presence of abnormal, cancerous cells in the lymph nodes, spleen, or other organs. The exact cause of lymphoma is unknown, but it is thought to be related to a combination of genetic and environmental factors. Treatment options for lymphoma include chemotherapy, radiation therapy, and bone marrow transplantation, among others.","This image depicts lymphoma, a type of cancer that affects the lymphatic system, characterized by the presence of abnormal, cancerous cells in the lymph nodes, spleen, or other organs. The exact cause of lymphoma is unknown, but it is thought to be related to a combination of genetic and environmental factors. Treatment options for lymphoma include chemotherapy, radiation therapy, and bone marrow transplantation, among others.",youtube,edu,lymphoma,lymphoma,No visual concepts,No body location information,No symptom information,No age information,No gender information
public/lentigo-adults-42.jpg,"This is a clinical skin image, diagnosed as light diseases and disorders of pigmentation.","This is a clinical skin image, diagnosed as light diseases and disorders of pigmentation.",public,knowledge,"irritated seborrheic keratosis (from ""sk/isk"")","proliferations, benign, non-melanocytic, seborrheic keratosis, irritated seborrheic keratosis (from ""sk/isk"")",pigmentation,No body location information,No symptom information,No age information,No gender information
youtube/NQXKZcaxkaE_frame_35901_0_0.jpg,"This image shows a wide field fundus photography of a patient with choroidal swelling, which is caused by pressure on the sclera and choroid, resulting in swelling beneath the choroid and reflected in the fundus examination.","This image shows a wide field fundus photography of a patient with choroidal swelling, which is caused by pressure on the sclera and choroid, resulting in swelling beneath the choroid and reflected in the fundus examination.",youtube,edu,choroidal swelling,choroidal swelling,No visual concepts,No body location information,No symptom information,No age information,No gender information
IIYI/1135_3.png,"An 80-year-old female presents with reddish, swollen, warm, and painful right lower leg persisting for 4 days. The symptoms started shortly after she scratched her leg due to 'athlete's foot' and rapidly progressed to involve the entire limb. She experienced fever with a highest recorded temperature of 38.1°C and has not received any treatment prior to hospital visit. During forum discussion, diagnosis of erysipelas, a type of lymphatic infection caused by a skin fungal infection from athlete's foot, was considered. The agreed treatment was bed rest, elevation of the affected limb, and administration of penicillin. Additionally, some suggestions included using traditional Chinese medicine formulations like Si Miao Yong An Tang featuring ingredients such as honeysuckle, scrophularia, licorice, and angelica.","An 80-year-old female presents with reddish, swollen, warm, and painful right lower leg persisting for 4 days. The symptoms started shortly after she scratched her leg due to 'athlete's foot' and rapidly progressed to involve the entire limb. She experienced fever with a highest recorded temperature of 38.1°C and has not received any treatment prior to hospital visit. During forum discussion, diagnosis of erysipelas, a type of lymphatic infection caused by a skin fungal infection from athlete's foot, was considered. The agreed treatment was bed rest, elevation of the affected limb, and administration of penicillin. Additionally, some suggestions included using traditional Chinese medicine formulations like Si Miao Yong An Tang featuring ingredients such as honeysuckle, scrophularia, licorice, and angelica.",IIYI_chinese,forum,cellulitis,"inflammatory, infectious, bacterial, cellulitis",red,"leg, foot",tender,80,female
youtube/Rwvw8xmMVP4_frame_8653_0_0.jpg,"This image shows a close-up view of a skin disease characterized by red, itchy patches on the skin. The cause of this condition is an overproduction of skin cells, which can be treated with topical creams and ointments to reduce inflammation and itching.","This image shows a close-up view of a skin disease characterized by red, itchy patches on the skin. The cause of this condition is an overproduction of skin cells, which can be treated with topical creams and ointments to reduce inflammation and itching.",youtube,edu,psoriasis,"inflammatory, non-infectious, psoriasis","red, patch",No body location information,No symptom information,No age information,No gender information
public/drug-eruptions-74.jpg,"This is a clinical skin image, diagnosed as exanthems and drug eruptions.","This is a clinical skin image, diagnosed as exanthems and drug eruptions.",public,knowledge,drug eruption,"inflammatory, non-infectious, drug eruption",No visual concepts,No body location information,No symptom information,No age information,No gender information
IIYI/28145_5.png,"A 63-year-old male complains of generalized itching, with hand backs and neck skin lesions that have persisted for more than ten years and lesions on the trunk and limbs' extensor surfaces for around six months. The primary condition discussed is Chronic Actinic Dermatitis (CAD). Other diagnoses considered are chronic eczema, generalized eczema, disseminated neurodermatitis, and the potential for Mycosis Fungoides (MF) being ruled out through pathology. Treatment suggestions include a regimen of Methimazole, Chlorpheniramine, Vitamin C, Compound Danshen Tablets, Vitamin B1, with specific dosages and treatment courses noted, including injections and topical applications. The possibility of chronic widespread neurodermatitis or chronic eczema along with treatments involving Methimazole, Chlorpheniramine, Vitamin C, Compound Danshen, and Vitamin B1 oral pills, and sulfur ointment applications for itching is also discussed.","A 63-year-old male complains of generalized itching, with hand backs and neck skin lesions that have persisted for more than ten years and lesions on the trunk and limbs' extensor surfaces for around six months. The primary condition discussed is Chronic Actinic Dermatitis (CAD). Other diagnoses considered are chronic eczema, generalized eczema, disseminated neurodermatitis, and the potential for Mycosis Fungoides (MF) being ruled out through pathology. Treatment suggestions include a regimen of Methimazole, Chlorpheniramine, Vitamin C, Compound Danshen Tablets, Vitamin B1, with specific dosages and treatment courses noted, including injections and topical applications. The possibility of chronic widespread neurodermatitis or chronic eczema along with treatments involving Methimazole, Chlorpheniramine, Vitamin C, Compound Danshen, and Vitamin B1 oral pills, and sulfur ointment applications for itching is also discussed.",IIYI_chinese,forum,"chronic actinic dermatitis, dermatitis","inflammatory, non-infectious, chronic actinic dermatitis, dermatitis","generalized, disseminated","neck, hand, oral",No symptom information,63,male
"edu/Electra Nicolaidou, Clio Dessinioti, Andreas Katsambas - Hypopigmentation. 1-CRC Press (2019)_00173_00668.png","Preparations containing mercury are still available in many developing countries, and their contents are poorly controlled. Peregrino et al. analyzed whitening products.","Preparations containing mercury are still available in many developing countries, and their contents are poorly controlled. Peregrino et al. analyzed whitening products.",textbook_english,knowledge,xeroderma pigmentosum,"hereditary, xeroderma pigmentosum",No visual concepts,No body location information,No symptom information,No age information,No gender information
IIYI/5381_1.png,"The poster reported sudden itching on the back of the hand with the appearance of blisters one day later. The itching was specific to the affected area and not painful. Additionally, there was a green pea-sized itchy spot on the lip, which was not painful, swollen, or red. No other discomforts were mentioned. Further discussions among forum users suggested the possibility of contact dermatitis or drug eruption. Users advised considering the history of the condition and closely examining for any potential triggers that might have been unnoticed by the poster. Potential diagnoses discussed included contact dermatitis and drug-induced dermatitis, with recommendations for a detailed examination of the patient's medical history and symptomatic treatment.","The poster reported sudden itching on the back of the hand with the appearance of blisters one day later. The itching was specific to the affected area and not painful. Additionally, there was a green pea-sized itchy spot on the lip, which was not painful, swollen, or red. No other discomforts were mentioned. Further discussions among forum users suggested the possibility of contact dermatitis or drug eruption. Users advised considering the history of the condition and closely examining for any potential triggers that might have been unnoticed by the poster. Potential diagnoses discussed included contact dermatitis and drug-induced dermatitis, with recommendations for a detailed examination of the patient's medical history and symptomatic treatment.",IIYI_chinese,forum,"contact dermatitis, drug eruption, dermatitis","inflammatory, non-infectious, eczema, contact dermatitis, drug eruption, dermatitis",No visual concepts,"lips, back, hand",tender,No age information,No gender information
youtube/Pi20y_f-dfY_frame_49685_0_0.jpg,"This image shows a close-up view of a skin disease characterized by red, itchy patches on the skin. The cause of this condition is an allergic reaction to certain substances, and treatment options include avoiding the allergen and using over-the-counter creams to relieve symptoms.","This image shows a close-up view of a skin disease characterized by red, itchy patches on the skin. The cause of this condition is an allergic reaction to certain substances, and treatment options include avoiding the allergen and using over-the-counter creams to relieve symptoms.",youtube,edu,allergic contact dermatitis,"inflammatory, non-infectious, eczema, contact dermatitis, allergic contact dermatitis","red, patch",No body location information,No symptom information,No age information,No gender information
youtube/3Dx-63EZR24_frame_27589_0_0.jpg,"This image shows channels on the surface of a planet, which indicate the presence of liquid water in the past and is a prerequisite for life.","This image shows channels on the surface of a planet, which indicate the presence of liquid water in the past and is a prerequisite for life.",youtube,edu,no definitive diagnosis,no definitive diagnosis,No visual concepts,No body location information,No symptom information,No age information,No gender information
youtube/Lng9V5iMGJQ_frame_8835_0_0.jpg,"This image shows a close-up view of a skin disease characterized by red, inflamed patches on the skin, likely caused by an allergic reaction to a specific substance. Treatment options include avoiding the allergen, using over-the-counter creams, and seeing a dermatologist for prescription medication.","This image shows a close-up view of a skin disease characterized by red, inflamed patches on the skin, likely caused by an allergic reaction to a specific substance. Treatment options include avoiding the allergen, using over-the-counter creams, and seeing a dermatologist for prescription medication.",youtube,edu,allergic contact dermatitis,"inflammatory, non-infectious, eczema, contact dermatitis, allergic contact dermatitis","red, patch",No body location information,No symptom information,No age information,No gender information
pubmed/64_38_PMC8088159_IDOJ_12_312_g002_0.png,"Clinical image showing skin-colored papules present bilaterally over the pinna, pre- and post-auricular areas.","Clinical image showing skin-colored papules present bilaterally over the pinna, pre- and post-auricular areas.",pubmed_english,knowledge,"irritated seborrheic keratosis (from ""sk/isk"")","proliferations, benign, non-melanocytic, seborrheic keratosis, irritated seborrheic keratosis (from ""sk/isk"")",papule,No body location information,No symptom information,No age information,No gender information
public/herpes-type-1-recurrent-3.jpg,"This is a clinical skin image, diagnosed as warts molluscum and other viral infections.","This is a clinical skin image, diagnosed as warts molluscum and other viral infections.",public,knowledge,molluscum contagiosum,"inflammatory, infectious, viral, molluscum contagiosum",No visual concepts,No body location information,No symptom information,No age information,No gender information
youtube/xEYjjpXikwc_frame_3712_0_0.jpg,"This image shows a close-up view of a skin disease characterized by red, inflamed patches on the skin. The cause of this condition is not yet clear, but it may be related to an autoimmune disorder. Treatment options include topical creams and corticosteroids to reduce inflammation and prevent further irritation.","This image shows a close-up view of a skin disease characterized by red, inflamed patches on the skin. The cause of this condition is not yet clear, but it may be related to an autoimmune disorder. Treatment options include topical creams and corticosteroids to reduce inflammation and prevent further irritation.",youtube,edu,"irritated seborrheic keratosis (from ""sk/isk"")","proliferations, benign, non-melanocytic, seborrheic keratosis, irritated seborrheic keratosis (from ""sk/isk"")","red, patch",No body location information,No symptom information,No age information,No gender information
IIYI/12557_4.png,The user is discussing a suspected case of adult measles. The post title suggests this and is followed by mentions of high fever and maculopapular rash. A user mentioned observing two cases of adult measles. One was confirmed through the presence of Koplik's spots while the second case was diagnosed outside of the forum discussions. The ongoing discussion appears to support the user's suspicion of having a typical presentation of adult measles.,The user is discussing a suspected case of adult measles. The post title suggests this and is followed by mentions of high fever and maculopapular rash. A user mentioned observing two cases of adult measles. One was confirmed through the presence of Koplik's spots while the second case was diagnosed outside of the forum discussions. The ongoing discussion appears to support the user's suspicion of having a typical presentation of adult measles.,IIYI_chinese,forum,measles,measles,No visual concepts,No body location information,No symptom information,No age information,No gender information
pubmed/fc_11_PMC10884590_Vetworld-17-150-g001_0.jpg,Epinephilus chlorostigma showing emaciation.,Epinephilus chlorostigma showing emaciation.,pubmed_fail,knowledge,no definitive diagnosis,,No visual concepts,No body location information,No symptom information,No age information,No gender information
youtube/R9Drgo1xMqg_frame_8972_0_0.jpg,"This image shows a skin disease characterized by a purple, raised, and itchy rash, often caused by an allergic reaction to certain substances, and can be treated with topical creams and avoiding the allergen.","This image shows a skin disease characterized by a purple, raised, and itchy rash, often caused by an allergic reaction to certain substances, and can be treated with topical creams and avoiding the allergen.",youtube,edu,allergic contact dermatitis,"inflammatory, non-infectious, eczema, contact dermatitis, allergic contact dermatitis","raised, purple",No body location information,No symptom information,No age information,No gender information
youtube/iFnBzD19FrE_frame_64737_0.jpg,"This image shows a close-up view of a skin disease characterized by red, inflamed patches on the skin, caused by an overproduction of skin cells. Treatment options include topical creams and ointments, as well as oral medications in some cases.","This image shows a close-up view of a skin disease characterized by red, inflamed patches on the skin, caused by an overproduction of skin cells. Treatment options include topical creams and ointments, as well as oral medications in some cases.",youtube,edu,proliferations,proliferations,"red, patch",oral,No symptom information,No age information,No gender information
pubmed/15_03_PMC10327660_dr-15-2-9617-g001_0.jpg,"A few days after hospitalization, erythema covered the body.","A few days after hospitalization, erythema covered the body.",pubmed_fail,knowledge,drug eruption,"inflammatory, non-infectious, drug eruption",erythema,No body location information,No symptom information,No age information,No gender information
youtube/ZO_3RM9qssE_frame_26250_1.jpg,"This image shows an exophytic papillary growth, which is a common benign tumor of the minor salivary gland, often seen in older patients, particularly in the lower lip and mandibular vestibules. It is characterized by multiple papillary projections that are continuous with the lining, which is covered by stratified squamous epithelium.","This image shows an exophytic papillary growth, which is a common benign tumor of the minor salivary gland, often seen in older patients, particularly in the lower lip and mandibular vestibules. It is characterized by multiple papillary projections that are continuous with the lining, which is covered by stratified squamous epithelium.",youtube,edu,exophytic papillary growth,exophytic papillary growth,tumor,lips,No symptom information,No age information,No gender information
edu/Amanda Oakley - Dermatology Made Easy-SCION PUBLISHING (2017)-OCR1_00475_17075.png,Exudative acute discoid eczema.,Exudative acute discoid eczema.,textbook_english,knowledge,"eczema, discoid eczema","inflammatory, non-infectious, eczema, eczema, discoid eczema",No visual concepts,No body location information,exudative,No age information,No gender information
youtube/Vrk7360xziM_frame_6521_0.jpg,"This image shows a close-up view of a skin disease characterized by red, itchy patches on the skin, caused by an allergic reaction to a particular substance. The treatment options include avoiding the allergen, using over-the-counter creams for relief, and consulting a dermatologist for further treatment.","This image shows a close-up view of a skin disease characterized by red, itchy patches on the skin, caused by an allergic reaction to a particular substance. The treatment options include avoiding the allergen, using over-the-counter creams for relief, and consulting a dermatologist for further treatment.",youtube,edu,allergic contact dermatitis,"inflammatory, non-infectious, eczema, contact dermatitis, allergic contact dermatitis","red, patch",No body location information,No symptom information,No age information,No gender information
